{
  "$schema": "https://json-schema.org/draft/2020-12/schema",
  "$id": "https://moyva.local/schemas/audio-mixer-bindings.schema.json",
  "title": "Moyva — Audio Mixer Bindings SO",
  "description": "JSON source of truth для Kruty1918.Moyva.HomeMenu.Runtime.AudioMixerBindingsSO. Згенеровано з фактичного Unity serialization contract; runtime читає JSON напряму.",
  "type": "object",
  "additionalProperties": false,
  "required": [
    "schema",
    "version",
    "id",
    "model"
  ],
  "properties": {
    "$schema": {
      "type": "string",
      "title": "JSON Schema"
    },
    "schema": {
      "const": "moyva.audio-mixer-bindings"
    },
    "version": {
      "type": "integer",
      "minimum": 1,
      "default": 1
    },
    "id": {
      "type": "string",
      "minLength": 1,
      "pattern": "^[a-z0-9]+(?:-[a-z0-9]+)*$",
      "title": "Стабільний ID",
      "description": "Стабільний ідентифікатор. Використовуйте дефіси; ID не залежить від filename або C# class name."
    },
    "model": {
      "const": "audio-mixer-bindings"
    },
    "migration": {
      "type": "object",
      "additionalProperties": true
    },
    "mixer": {
      "type": [
        "object",
        "null"
      ],
      "description": "Opaque Unity asset reference. Gameplay values не зберігаються в Unity asset.",
      "properties": {
        "$asset": {
          "type": "string",
          "title": "Asset ID"
        },
        "editorPath": {
          "type": "string",
          "description": "Editor-only path для діагностики/регенерації catalog."
        },
        "required": {
          "type": "boolean",
          "default": true
        }
      },
      "required": [
        "$asset"
      ],
      "title": "Mixer"
    },
    "masterParameter": {
      "type": [
        "string",
        "null"
      ],
      "title": "Master Parameter"
    },
    "musicParameter": {
      "type": [
        "string",
        "null"
      ],
      "title": "Music Parameter"
    },
    "sfxParameter": {
      "type": [
        "string",
        "null"
      ],
      "title": "Sfx Parameter"
    },
    "uiParameter": {
      "type": [
        "string",
        "null"
      ],
      "title": "Ui Parameter"
    },
    "ambienceParameter": {
      "type": [
        "string",
        "null"
      ],
      "title": "Ambience Parameter"
    },
    "defaultMaster": {
      "type": "number",
      "title": "Default Master"
    },
    "defaultMusic": {
      "type": "number",
      "title": "Default Music"
    },
    "defaultSfx": {
      "type": "number",
      "title": "Default Sfx"
    },
    "defaultUi": {
      "type": "number",
      "title": "Default Ui"
    },
    "defaultAmbience": {
      "type": "number",
      "title": "Default Ambience"
    }
  }
}
